{
  "id": 1,
  "game_title": "Halo: Combat Evolved",
  "release_date": "2001-11-15",
  "platform": 14,
  "region_id": 70,
  "country_id": 93,
  "overview": "example-value",
  "youtube": "example-value",
  "players": 69,
  "coop": "example-value",
  "rating": "example-value",
  "alternates": [
    "example-value"
  ]
}